{
  "topic": "Large-language-model agents for academic literature review workflows",
  "objective": "Turn a broad thesis idea into a focused review topic and retrieval plan.",
  "target_artifact": "research brief",
  "language": "zh-CN",
  "domain": "information systems",
  "time_window": {
    "from_year": 2021,
    "to_year": 2026
  },
  "questions": [
    "Which stages of academic literature review are currently supported by LLM agents?",
    "How do these systems evaluate grounding, coverage, and citation faithfulness?",
    "What gaps remain for practical use in thesis or paper writing?"
  ],
  "keywords": [
    "LLM agent",
    "literature review",
    "scientific writing",
    "citation faithfulness",
    "research workflow"
  ],
  "in_scope": [
    "agentic systems for retrieval, screening, synthesis, or related-work drafting",
    "papers in English or Chinese"
  ],
  "out_of_scope": [
    "general chatbot assistants with no research workflow design",
    "non-academic content generation tools"
  ],
  "next_skill": "literature-review"
}
